{
  "$schema": "./deployments.schema.json",
  "updatedAt": "2026-09-01",
  "decisionIssue": 236,
  "target": "hackathon-demo-quasar-cutover",
  "submissionReady": false,
  "legacyAnchorReference": {
    "cluster": "devnet",
    "programId": "794nTFNyJknzDrR13ApSfVyNCRvcvnCN3BVDfic8dcZD",
    "purpose": "Legacy/reference Anchor deployment only. Must not be used as hackathon demo target after Quasar cutover."
  },
  "quasarDeployments": {
    "devnet": {
      "cluster": "devnet",
      "rpcHttp": "https://api.devnet.solana.com",
      "programId": "VYCbMszux9seLK2aXFZMECMBFURvfuJLXsXPmJS5igW",
      "status": "blocked-client-abi-deployment-mismatch",
      "scope": [
        "pre-job-binding-devnet-deployment-historical-only",
        "not-submission-evidence",
        "superseded-by-local-surfpool-current-source-quasar-lane",
        "magicblock-per-explicitly-not-final-claim-without-live-quasar-validation"
      ],
      "knownGaps": [
        "Client/deployment ABI mismatch: the in-repo Quasar client encodes the post-job-binding instruction layout (commit 34 bytes, reveal 34 bytes, attest 6 bytes) while these devnet programs expect the pre-binding layout (commit 114 bytes, reveal 49 bytes, attest 54 bytes).",
        "PDA derivation mismatch: the client seeds rating and attestation PDAs on the escrow account address; these devnet programs seed them on a caller-supplied job_id.",
        "Commitment pre-image mismatch: the client commits sha256(score || salt || escrow_address || program_id); these devnet programs verify sha256(score || salt || job_id || program_id).",
        "Escrow lock signer mismatch: the client requires the payee (Agent B) to co-sign lock; these devnet programs do not.",
        "No redeploy is authorized or performed, so the recorded devnet-full-flow-demo PASS is not reproducible and is retained as historical record only."
      ],
      "evidence": [
        {
          "type": "read-only-rpc-account-check",
          "checkedAt": "2026-05-05T20:25:00+10:00",
          "command": "solana account VYCbMszux9seLK2aXFZMECMBFURvfuJLXsXPmJS5igW --url https://api.devnet.solana.com",
          "result": "executable=true; owner=BPFLoaderUpgradeab1e11111111111111111111111; no signing or wallet mutation"
        },
        {
          "type": "repo-artifact",
          "path": "docs/verifiable-agent-protocol/colosseum-frontier-2026-04/QUASAR-REGISTRY-PARITY-REPORT.md"
        },
        {
          "type": "repo-artifact",
          "path": "docs/verifiable-agent-protocol/colosseum-frontier-2026-04/QUASAR-REPUTATION-PARITY-REPORT.md"
        },
        {
          "type": "repo-artifact",
          "path": "docs/verifiable-agent-protocol/colosseum-frontier-2026-04/QUASAR-ATTESTATION-PARITY-REPORT.md"
        },
        {
          "type": "repo-artifact",
          "path": "docs/verifiable-agent-protocol/colosseum-frontier-2026-04/QUASAR-PER-PARITY-REPORT.md"
        },
        {
          "type": "devnet-registration-artifact",
          "path": "artifacts/quasar-devnet-registration/20260505T211525Z/SUMMARY.md"
        },
        {
          "type": "devnet-full-flow-demo",
          "checkedAt": "2026-05-06T15:47:00+10:00",
          "command": "DEMO_PROGRAM_TARGET=quasar HACKATHON_DEMO_TARGET=quasar DEMO_SETTLEMENT_MODE=public npm run demo --prefix packages/demo-agents",
          "result": "SUPERSEDED / NOT REPRODUCIBLE as of 2026-09-01: this PASS was recorded against the pre-job-binding Quasar programs. The current in-repo client encodes the post-job-binding ABI, so the recorded command no longer reproduces against these program IDs. Retained as historical record only; not submission evidence. Original 2026-05-06 record: PASS; full A→B→C completed in 6516ms after devnet Reputation upgrade."
        },
        {
          "type": "devnet-program-upgrade",
          "program": "reputation",
          "checkedAt": "2026-05-06T15:45:00+10:00",
          "programId": "nb9rLVjoHMibsgfRGgKuPqm6M8GVcH9r6bYNfg7Yiy6",
          "upgradeAuthority": "d4ST3N4Vkio1Xsg2NaF6Zox7Xq8MdqWihvyip9AHioR",
          "tx": "24bf49dnB9YCiqS6uT21jnQHRy9RveTquffBSNjhUpeHPE663kf7PEMCMch5k4ZR9sADxYUWvVijufEN993PVzqg",
          "result": "Historical only: upgraded to the pre-job-binding Quasar commitment verification sha256(score || salt || job_id || program_id). The current in-repo reputation source binds commitments to the escrow address instead, so this deployment is behind the repository sources."
        },
        {
          "type": "client-abi-deployment-mismatch-review",
          "checkedAt": "2026-09-01",
          "result": "Source review compared packages/demo-agents/src/demo.ts against experiments/quasar-{escrow,reputation,attestation}/src. The client matches current repository sources; the recorded devnet programs do not. No RPC call, signing, wallet access, or deployment was performed for this review."
        }
      ],
      "knownLimitations": [
        "MagicBlock PER/TEE live execution is not included in any Quasar claim; the Quasar demo uses public Quasar escrow settlement and fails closed if DEMO_SETTLEMENT_MODE=magicblock_per is requested.",
        "Legacy Anchor artifacts remain historical comparison only and are not final-demo proof.",
        "These devnet program IDs are gated off in packages/demo-agents/src/config.ts: requesting the Quasar target on any profile other than local-surfpool is refused before any transaction construction, signer access, or RPC call.",
        "Quasar remains experimental. No deployment, security, audit, submission, grant, or production readiness is claimed."
      ],
      "programIds": {
        "escrow": "VYCbMszux9seLK2aXFZMECMBFURvfuJLXsXPmJS5igW",
        "registry": "Xk7jczJZ1HHJZuE1ZUWDqFmowxYhnom7mWzrNSGf9FU",
        "reputation": "nb9rLVjoHMibsgfRGgKuPqm6M8GVcH9r6bYNfg7Yiy6",
        "attestation": "CRGsWWkptdxsH6N6aWAyahLbuMsT58yM624EopEsv1Ex"
      }
    }
  },
  "submissionReadyReason": "BLOCKED: the recorded devnet Quasar programs predate the 2026-08 job-binding rework and no longer match the in-repo Quasar client. The demo client encodes the current experiments/quasar-* sources (commit/reveal/attest drop caller-supplied job_id/consumer_pk/specialist_pk, rating and attestation PDAs are seeded on the escrow address, and escrow lock requires the payee to sign), while the deployed devnet programs still expect the pre-binding layout. No redeploy is claimed or performed. Only the local-surfpool lane with four explicit valid loopback-configured Quasar program IDs built from current sources is retained as Quasar evidence.",
  "criticalSuccessFactors": [
    "no-demo-critical-anchor-paths",
    "quasar-native-registry-reputation-attestation",
    "quasar-native-escrow-settlement-demo",
    "magicblock-per-quasar-validation-or-explicitly-not-in-final-claim"
  ]
}
